{
  "schema_version": 1,
  "id": "ja-02",
  "language": "ja",
  "description": "ja anime dialogue, late act",
  "tags": [
    "anime",
    "dialogue",
    "heavy-asr-noise",
    "stranded-unit"
  ],
  "license": {
    "redistributable": false,
    "source_class": "third-party",
    "spdx": null,
    "attribution": "Yowayowa Sensei E01 (SubsPlease)"
  },
  "capture": {
    "voxweave_commit": "2f1c42d7fe19bc45bd7cdf7a5176e3215692db65",
    "source_digest": "12dcb0609c22769361b78f54814bbec04f3548695ba44530bf7143c2f7bd691b",
    "window_duration_s": 240.0,
    "dependency_versions": {
      "python": "3.13.12",
      "pysbd": "0.3.4",
      "budoux": "0.8.4",
      "jieba": "0.42.1",
      "fugashi": "1.5.2"
    },
    "config": {
      "language": "ja",
      "max_line_length": 18,
      "max_lines": 1,
      "max_cue_s": 7.0,
      "min_cue_s": 0.5,
      "cps": 7.0,
      "lag_out_s": 0.25,
      "glue_gap_s": 0.3,
      "gap_thresholds": {
        "clause_ms": 560,
        "vad_skip_ms": 1000,
        "offline_ms": 980
      },
      "gap_adaptive": false,
      "shot_snap_s": 0.458,
      "shot_snap_frames": 10.992,
      "diarize_format": {
        "min_atom_overlap_s": 0.05,
        "min_run_s": 0.2,
        "edge_run_min_s": 0.12,
        "merge_gap_s": 0.35,
        "drop_contained_s": 0.2
      }
    },
    "missing_inputs": [
      "sing_spans"
    ]
  },
  "word_segments": [
    {
      "id": "u0",
      "text": "を",
      "start": 0.06,
      "end": 0.12
    },
    {
      "id": "u1",
      "text": "守",
      "start": 0.24,
      "end": 0.32
    },
    {
      "id": "u2",
      "text": "っ",
      "start": 0.38,
      "end": 0.46
    },
    {
      "id": "u3",
      "text": "て",
      "start": 0.58,
      "end": 0.64
    },
    {
      "id": "u4",
      "text": "く",
      "start": 0.72,
      "end": 0.76
    },
    {
      "id": "u5",
      "text": "れ",
      "start": 0.82,
      "end": 0.88
    },
    {
      "id": "u6",
      "text": "ま",
      "start": 0.96,
      "end": 1.02
    },
    {
      "id": "u7",
      "text": "し",
      "start": 1.12,
      "end": 1.16
    },
    {
      "id": "u8",
      "text": "た",
      "start": 1.22,
      "end": 1.26
    },
    {
      "id": "u9",
      "text": "。",
      "start": 1.26,
      "end": 1.26
    },
    {
      "id": "u10",
      "text": "袋",
      "start": 2.1,
      "end": 2.28
    },
    {
      "id": "u11",
      "text": "が",
      "start": 2.34,
      "end": 2.4
    },
    {
      "id": "u12",
      "text": "濡",
      "start": 2.5,
      "end": 2.56
    },
    {
      "id": "u13",
      "text": "っ",
      "start": 2.62,
      "end": 2.68
    },
    {
      "id": "u14",
      "text": "て",
      "start": 2.76,
      "end": 2.82
    },
    {
      "id": "u15",
      "text": "し",
      "start": 2.92,
      "end": 2.98
    },
    {
      "id": "u16",
      "text": "ま",
      "start": 3.06,
      "end": 3.14
    },
    {
      "id": "u17",
      "text": "い",
      "start": 3.24,
      "end": 3.24
    },
    {
      "id": "u18",
      "text": "ま",
      "start": 3.32,
      "end": 3.38
    },
    {
      "id": "u19",
      "text": "し",
      "start": 3.48,
      "end": 3.52
    },
    {
      "id": "u20",
      "text": "た",
      "start": 3.56,
      "end": 3.62
    },
    {
      "id": "u21",
      "text": "が",
      "start": 3.72,
      "end": 3.8
    },
    {
      "id": "u22",
      "text": "。",
      "start": 3.8,
      "end": 3.8
    },
    {
      "id": "u23",
      "text": "は",
      "start": 7.14,
      "end": 7.22
    },
    {
      "id": "u24",
      "text": "。",
      "start": 7.22,
      "end": 7.22
    },
    {
      "id": "u25",
      "text": "私",
      "start": 7.54,
      "end": 7.62
    },
    {
      "id": "u26",
      "text": "、",
      "start": 7.62,
      "end": 7.62
    },
    {
      "id": "u27",
      "text": "お",
      "start": 8.24,
      "end": 8.24
    },
    {
      "id": "u28",
      "text": "好",
      "start": 8.5,
      "end": 8.54
    },
    {
      "id": "u29",
      "text": "き",
      "start": 8.58,
      "end": 8.66
    },
    {
      "id": "u30",
      "text": "な",
      "start": 8.76,
      "end": 8.84
    },
    {
      "id": "u31",
      "text": "ん",
      "start": 8.92,
      "end": 8.92
    },
    {
      "id": "u32",
      "text": "で",
      "start": 9.0,
      "end": 9.1
    },
    {
      "id": "u33",
      "text": "す",
      "start": 9.24,
      "end": 9.32
    },
    {
      "id": "u34",
      "text": "。",
      "start": 9.32,
      "end": 9.32
    },
    {
      "id": "u35",
      "text": "守",
      "start": 9.88,
      "end": 10.12
    },
    {
      "id": "u36",
      "text": "っ",
      "start": 10.18,
      "end": 10.22
    },
    {
      "id": "u37",
      "text": "て",
      "start": 10.26,
      "end": 10.32
    },
    {
      "id": "u38",
      "text": "く",
      "start": 10.4,
      "end": 10.46
    },
    {
      "id": "u39",
      "text": "れ",
      "start": 10.52,
      "end": 10.58
    },
    {
      "id": "u40",
      "text": "て",
      "start": 10.68,
      "end": 10.78
    },
    {
      "id": "u41",
      "text": "あ",
      "start": 11.16,
      "end": 11.16
    },
    {
      "id": "u42",
      "text": "り",
      "start": 11.24,
      "end": 11.3
    },
    {
      "id": "u43",
      "text": "が",
      "start": 11.38,
      "end": 11.46
    },
    {
      "id": "u44",
      "text": "と",
      "start": 11.58,
      "end": 11.68
    },
    {
      "id": "u45",
      "text": "う",
      "start": 11.74,
      "end": 11.74
    },
    {
      "id": "u46",
      "text": "。",
      "start": 11.74,
      "end": 11.74
    },
    {
      "id": "u47",
      "text": "射",
      "start": 12.7,
      "end": 12.82
    },
    {
      "id": "u48",
      "text": "つ",
      "start": 12.92,
      "end": 13.02
    },
    {
      "id": "u49",
      "text": "が",
      "start": 13.08,
      "end": 13.14
    },
    {
      "id": "u50",
      "text": "え",
      "start": 13.3,
      "end": 13.3
    },
    {
      "id": "u51",
      "text": "ら",
      "start": 13.4,
      "end": 13.48
    },
    {
      "id": "u52",
      "text": "い",
      "start": 13.6,
      "end": 13.6
    },
    {
      "id": "u53",
      "text": "こ",
      "start": 13.74,
      "end": 13.8
    },
    {
      "id": "u54",
      "text": "と",
      "start": 13.9,
      "end": 13.98
    },
    {
      "id": "u55",
      "text": "に",
      "start": 14.1,
      "end": 14.2
    },
    {
      "id": "u56",
      "text": "。",
      "start": 14.2,
      "end": 14.2
    },
    {
      "id": "u57",
      "text": "先",
      "start": 16.7,
      "end": 16.84
    },
    {
      "id": "u58",
      "text": "生",
      "start": 16.9,
      "end": 17.06
    },
    {
      "id": "u59",
      "text": "、",
      "start": 17.06,
      "end": 17.06
    },
    {
      "id": "u60",
      "text": "う",
      "start": 17.8,
      "end": 17.8
    },
    {
      "id": "u61",
      "text": "わ",
      "start": 17.86,
      "end": 17.9
    },
    {
      "id": "u62",
      "text": "ぎ",
      "start": 17.96,
      "end": 18.04
    },
    {
      "id": "u63",
      "text": "は",
      "start": 18.1,
      "end": 18.14
    },
    {
      "id": "u64",
      "text": "き",
      "start": 18.22,
      "end": 18.28
    },
    {
      "id": "u65",
      "text": "つ",
      "start": 18.34,
      "end": 18.4
    },
    {
      "id": "u66",
      "text": "い",
      "start": 18.46,
      "end": 18.46
    },
    {
      "id": "u67",
      "text": "た",
      "start": 18.52,
      "end": 18.58
    },
    {
      "id": "u68",
      "text": "方",
      "start": 18.66,
      "end": 18.8
    },
    {
      "id": "u69",
      "text": "が",
      "start": 18.86,
      "end": 18.92
    },
    {
      "id": "u70",
      "text": "い",
      "start": 19.14,
      "end": 19.14
    },
    {
      "id": "u71",
      "text": "い",
      "start": 19.18,
      "end": 19.18
    },
    {
      "id": "u72",
      "text": "で",
      "start": 19.24,
      "end": 19.32
    },
    {
      "id": "u73",
      "text": "す",
      "start": 19.42,
      "end": 19.5
    },
    {
      "id": "u74",
      "text": "。",
      "start": 19.5,
      "end": 19.5
    },
    {
      "id": "u75",
      "text": "弱",
      "start": 19.96,
      "end": 20.04
    },
    {
      "id": "u76",
      "text": "い",
      "start": 20.16,
      "end": 20.16
    },
    {
      "id": "u77",
      "text": "弱",
      "start": 20.98,
      "end": 21.04
    },
    {
      "id": "u78",
      "text": "い",
      "start": 21.26,
      "end": 21.26
    },
    {
      "id": "u79",
      "text": "先",
      "start": 21.5,
      "end": 21.64
    },
    {
      "id": "u80",
      "text": "生",
      "start": 21.72,
      "end": 21.88
    },
    {
      "id": "u81",
      "text": "は",
      "start": 21.92,
      "end": 21.98
    },
    {
      "id": "u82",
      "text": "運",
      "start": 22.56,
      "end": 22.74
    },
    {
      "id": "u83",
      "text": "も",
      "start": 22.82,
      "end": 22.9
    },
    {
      "id": "u84",
      "text": "弱",
      "start": 23.02,
      "end": 23.08
    },
    {
      "id": "u85",
      "text": "い",
      "start": 29.5,
      "end": 30.2
    },
    {
      "id": "u86",
      "text": "弱",
      "start": 34.66,
      "end": 34.86
    },
    {
      "id": "u87",
      "text": "い",
      "start": 35.32,
      "end": 35.32
    },
    {
      "id": "u88",
      "text": "。",
      "start": 35.32,
      "end": 35.32
    },
    {
      "id": "u89",
      "text": "あ",
      "start": 37.24,
      "end": 37.24
    },
    {
      "id": "u90",
      "text": "あ",
      "start": 37.48,
      "end": 37.48
    },
    {
      "id": "u91",
      "text": "。",
      "start": 37.48,
      "end": 37.48
    },
    {
      "id": "u92",
      "text": "ひ",
      "start": 39.0,
      "end": 39.08
    },
    {
      "id": "u93",
      "text": "ば",
      "start": 39.16,
      "end": 39.22
    },
    {
      "id": "u94",
      "text": "む",
      "start": 39.28,